{
  "claude_bin_resolved": "<tmp>/bin/claude",
  "claude_version": "2.1.314 (Claude Code)",
  "claude_version_ok": true,
  "default_kind": "implement",
  "kinds": [
    {
      "auto_exit": true,
      "backstop": true,
      "builtin": true,
      "claude_args": [],
      "cwd": "caller",
      "env": {
        "allow": [],
        "inherit": true,
        "path_prepend": [],
        "set_names": []
      },
      "fallback": false,
      "implicit_done": true,
      "interactive_timeout": null,
      "max_turns": null,
      "mcp": "inherit",
      "model": null,
      "name": "implement",
      "notes_context": true,
      "path": "/opt/claude-session/bin:<tmp>/bin",
      "permission_profile": "default",
      "read_dirs": [],
      "reads_third_party": false,
      "required_env_names": [],
      "sandbox": "off",
      "sandbox_available": null,
      "sandbox_problems": [],
      "setting_sources": [
        "user",
        "project",
        "local"
      ],
      "timeout": 3600.0,
      "warnings": [],
      "write_dirs": []
    },
    {
      "auto_exit": true,
      "backstop": true,
      "builtin": true,
      "claude_args": [],
      "cwd": "caller",
      "env": {
        "allow": [],
        "inherit": true,
        "path_prepend": [],
        "set_names": []
      },
      "fallback": false,
      "implicit_done": true,
      "interactive_timeout": null,
      "max_turns": null,
      "mcp": "inherit",
      "model": null,
      "name": "draft-ticket",
      "notes_context": true,
      "path": "/opt/claude-session/bin:<tmp>/bin",
      "permission_profile": "default",
      "read_dirs": [],
      "reads_third_party": false,
      "required_env_names": [],
      "sandbox": "off",
      "sandbox_available": null,
      "sandbox_problems": [],
      "setting_sources": [
        "user",
        "project",
        "local"
      ],
      "timeout": 3600.0,
      "warnings": [],
      "write_dirs": []
    },
    {
      "auto_exit": true,
      "backstop": true,
      "builtin": true,
      "claude_args": [],
      "cwd": "caller",
      "env": {
        "allow": [],
        "inherit": true,
        "path_prepend": [],
        "set_names": []
      },
      "fallback": false,
      "implicit_done": true,
      "interactive_timeout": null,
      "max_turns": null,
      "mcp": "inherit",
      "model": null,
      "name": "audit",
      "notes_context": false,
      "path": "/opt/claude-session/bin:<tmp>/bin",
      "permission_profile": "default",
      "read_dirs": [],
      "reads_third_party": false,
      "required_env_names": [],
      "sandbox": "off",
      "sandbox_available": null,
      "sandbox_problems": [],
      "setting_sources": [
        "user",
        "project",
        "local"
      ],
      "timeout": 3600.0,
      "warnings": [],
      "write_dirs": []
    },
    {
      "auto_exit": true,
      "backstop": true,
      "builtin": true,
      "claude_args": [],
      "cwd": "caller",
      "env": {
        "allow": [],
        "inherit": true,
        "path_prepend": [],
        "set_names": []
      },
      "fallback": false,
      "implicit_done": true,
      "interactive_timeout": null,
      "max_turns": null,
      "mcp": "inherit",
      "model": null,
      "name": "improve",
      "notes_context": false,
      "path": "/opt/claude-session/bin:<tmp>/bin",
      "permission_profile": "default",
      "read_dirs": [],
      "reads_third_party": false,
      "required_env_names": [],
      "sandbox": "off",
      "sandbox_available": null,
      "sandbox_problems": [],
      "setting_sources": [
        "user",
        "project",
        "local"
      ],
      "timeout": 3600.0,
      "warnings": [],
      "write_dirs": []
    },
    {
      "auto_exit": true,
      "backstop": true,
      "builtin": true,
      "claude_args": [],
      "cwd": "session-dir",
      "env": {
        "allow": [],
        "inherit": false,
        "path_prepend": [],
        "set_names": []
      },
      "fallback": false,
      "implicit_done": false,
      "interactive_timeout": null,
      "max_turns": null,
      "mcp": "none",
      "model": null,
      "name": "rank",
      "notes_context": false,
      "path": "/opt/claude-session/bin:<tmp>/bin",
      "permission_profile": "readonly",
      "read_dirs": [
        "<generated>"
      ],
      "reads_third_party": false,
      "required_env_names": [],
      "sandbox": "preferred",
      "sandbox_available": true,
      "sandbox_problems": [],
      "setting_sources": [],
      "timeout": 900.0,
      "warnings": [],
      "write_dirs": []
    },
    {
      "auto_exit": true,
      "backstop": true,
      "builtin": true,
      "claude_args": [],
      "cwd": "session-dir",
      "env": {
        "allow": [],
        "inherit": false,
        "path_prepend": [],
        "set_names": []
      },
      "fallback": false,
      "implicit_done": true,
      "interactive_timeout": null,
      "max_turns": null,
      "mcp": "none",
      "model": null,
      "name": "review",
      "notes_context": false,
      "path": "/opt/claude-session/bin:<tmp>/bin",
      "permission_profile": "review",
      "read_dirs": [
        "<generated>"
      ],
      "reads_third_party": true,
      "required_env_names": [],
      "sandbox": "required",
      "sandbox_available": true,
      "sandbox_problems": [],
      "setting_sources": [],
      "timeout": 7200.0,
      "warnings": [],
      "write_dirs": []
    },
    {
      "auto_exit": true,
      "backstop": true,
      "builtin": true,
      "claude_args": [],
      "cwd": "session-dir",
      "env": {
        "allow": [],
        "inherit": false,
        "path_prepend": [],
        "set_names": []
      },
      "fallback": false,
      "implicit_done": false,
      "interactive_timeout": null,
      "max_turns": null,
      "mcp": "none",
      "model": null,
      "name": "gate-check",
      "notes_context": false,
      "path": "/opt/claude-session/bin:<tmp>/bin",
      "permission_profile": "review",
      "read_dirs": [
        "<generated>"
      ],
      "reads_third_party": true,
      "required_env_names": [],
      "sandbox": "required",
      "sandbox_available": true,
      "sandbox_problems": [],
      "setting_sources": [],
      "timeout": 900.0,
      "warnings": [],
      "write_dirs": []
    },
    {
      "auto_exit": true,
      "backstop": true,
      "builtin": true,
      "claude_args": [],
      "cwd": "caller",
      "env": {
        "allow": [],
        "inherit": false,
        "path_prepend": [],
        "set_names": [
          "GIT_CONFIG_GLOBAL",
          "GIT_CONFIG_NOSYSTEM"
        ]
      },
      "fallback": false,
      "implicit_done": true,
      "interactive_timeout": null,
      "max_turns": null,
      "mcp": "none",
      "model": null,
      "name": "respond",
      "notes_context": false,
      "path": "/opt/claude-session/bin:<tmp>/bin",
      "permission_profile": "respond",
      "read_dirs": [
        "<generated>"
      ],
      "reads_third_party": true,
      "required_env_names": [
        "GIT_CONFIG_GLOBAL",
        "GIT_CONFIG_NOSYSTEM"
      ],
      "sandbox": "required",
      "sandbox_available": true,
      "sandbox_problems": [],
      "setting_sources": [],
      "timeout": 3600.0,
      "warnings": [],
      "write_dirs": []
    }
  ],
  "min_claude_version": "2.1.312",
  "repo": null,
  "state_dir_warnings": [],
  "warnings": []
}
